{
  "schema_version": "0.1.0",
  "annotation_id": "ann-toy-001",
  "dossier_id": "dossier-toy-owner-repo-42",
  "annotator_id": "annotator-a",
  "created_at": "2026-06-02T01:00:00Z",
  "category_ratings": {
    "intent": 2,
    "requirement_traceability": 2,
    "test_rationale": 2,
    "regression_safety": 1,
    "risk_analysis": 0,
    "scope_justification": 1,
    "change_summary": 2,
    "agent_trace": 1,
    "limitations": 1,
    "reviewer_actionability": 1,
    "ownership_handoff": 0
  },
  "overall_evidence_sufficiency": 2,
  "merge_decision_support": 2,
  "blocking_concerns": [
    "no risk analysis",
    "ownership unclear"
  ],
  "reviewer_confidence": 4,
  "notes": "Good toy dossier, but lacks risk and handoff evidence."
}
